{
  "id": "github-topics-client-package",
  "family": "api_schema",
  "request": "Implement an offline integration for the pinned GitHub PUT /repos/{owner}/{repo}/topics JSON body and 200 topic response. Publish request and response validators plus consumer mapping with output schema. Both payloads are objects requiring names: an array of strings; empty arrays are valid; null, absent names, nonstrings and nonarray names are invalid. Unknown properties are allowed per the pinned OpenAPI default. Map a valid response to exactly {topics: names}, preserving order, duplicates and case; no extra fields. The mapping output schema requires topics array of strings and forbids other fields. The server documentation says names are saved lowercase: this offline consumer does not emulate normalization or verify a server. Request validators validate documented shape, not an invented lexical topic policy. Mapping is only promised on valid response inputs, at most 128 names, bounded payloads. OpenAPI 3.0.3 adaptation: annotations/examples removed, required lists preserved, absent nullable means null forbidden here; no readOnly/writeOnly occur in the selected body/topic schemas. No unreviewed general OpenAPI conversion. This is benchmark-authored client work, not a historical GitHub change. Additionally publish outbound mapping from an authored client object requiring topics (array of strings) to exactly {names: topics}, preserving order, duplicates and case. Valid client input may contain unknown fields, which must be dropped. Empty arrays are valid. The outbound output_schema must require names array of strings, allow no extra fields, and reject null/non-string elements. Inbound consumer and outbound mapping must round-trip all valid topic arrays without normalization. Mapping promises apply only to valid inputs, arrays at most 128 items; validators themselves impose no invented maxItems. This fourth output builds the documented PUT body, not an invented API operation.",
  "required_outputs": [
    {
      "id": "request",
      "format": "schema",
      "public_inputs": [
        "topic"
      ]
    },
    {
      "id": "response",
      "format": "schema",
      "public_inputs": [
        "topic"
      ]
    },
    {
      "id": "consumer",
      "format": "mapping",
      "public_inputs": [
        "topic"
      ]
    },
    {
      "id": "outbound",
      "format": "mapping",
      "public_inputs": [
        "client"
      ]
    }
  ],
  "tables": {},
  "sources": {},
  "examples": {
    "topic": {
      "names": [
        "api",
        "tools"
      ]
    },
    "client": {
      "topics": [
        "API",
        "tools",
        "tools"
      ]
    }
  },
  "outlines": [
    {
      "id": "independent",
      "units": [
        {
          "id": "request",
          "worker": "w0",
          "outputs": [
            "request"
          ],
          "depends": [],
          "description": "Implement request according to the public request."
        },
        {
          "id": "response",
          "worker": "w1",
          "outputs": [
            "response"
          ],
          "depends": [],
          "description": "Implement response according to the public request."
        },
        {
          "id": "consumer",
          "worker": "w2",
          "outputs": [
            "consumer"
          ],
          "depends": [],
          "description": "Implement consumer according to the public request."
        },
        {
          "id": "outbound",
          "worker": "w3",
          "outputs": [
            "outbound"
          ],
          "depends": [],
          "description": "Implement outbound according to the public request."
        }
      ]
    },
    {
      "id": "shared",
      "units": [
        {
          "id": "shared_base",
          "worker": "w0",
          "outputs": [],
          "depends": [],
          "description": "Implement shared_base according to the public request."
        },
        {
          "id": "request",
          "worker": "w1",
          "outputs": [
            "request"
          ],
          "depends": [
            "shared_base"
          ],
          "description": "Implement request according to the public request."
        },
        {
          "id": "response",
          "worker": "w2",
          "outputs": [
            "response"
          ],
          "depends": [
            "shared_base"
          ],
          "description": "Implement response according to the public request."
        },
        {
          "id": "consumer",
          "worker": "w3",
          "outputs": [
            "consumer"
          ],
          "depends": [
            "shared_base"
          ],
          "description": "Implement consumer according to the public request."
        },
        {
          "id": "outbound",
          "worker": "w4",
          "outputs": [
            "outbound"
          ],
          "depends": [
            "shared_base"
          ],
          "description": "Implement outbound according to the public request."
        }
      ]
    }
  ]
}
